822;"Григорьев С.Г.; Вострокнутов И.Е.; Родионов И.В.; Акимова И.В.; Воробьев М.В.";Интеграция основного и дополнительного информационно-технологического образования на основе подготовки учащихся в центрах цифрового образования детей;2022;Информатика и образование;37;2;0;0;0;8;0;0;0;0;0;0;0;0;10;0;0;9;8;7;0;7;0;7;7;0;0;0;0;0;8;0;0;0;0;8;0;0;7;7;0;0;0;8;8;0;0;0;0;0;8;0;0;9;0;0;0;0;0;8;7;0;0;7;0;0;8;8;0;0;0;0;9;9;0;0;0;0;7;0;0;0;0;7;0;0;0;0;0;0;0;0;0;0;7;7;0;0;8;8;0;0;7;7;0;0;0;0;8;0;0;0;0;0;8;8;7;0;0;0;0;7;0;0;0;7;0;7;0;7;0;0;0;0;0;9;8;0;0;0;0;7;9;7;7;0;0;7;7;0;8;0;8;0;8;9;0;0;7;9;0;0;0;8;7;7;0;7;7;0;7;0;8;8;0;0;7;7;0;0;0;7;0;8;0;0;0;0;0;0;0;7;7;0;8;0;7;0;0;7;0;0;0;0;0;7;0;7;8;8;7;0;7;8;8;0;0;8;0;8;9;0
821;Уваров А.Ю.;Цифровое обновление образования: на пути к «идеальной школе»;2022;Информатика и образование;37;2;0;2;2;2;0;0;0;0;0;0;0;0;0;0;7;0;0;0;0;0;0;0;0;0;0;0;0;0;5;0;0;0;0;0;7;0;7;0;0;0;5;5;5;0;0;0;0;0;9;0;0;0;8;0;0;0;0;8;7;0;7;0;10;7;7;7;8;8;8;8;8;8;0;8;0;0;0;7;0;0;0;8;0;0;0;0;0;0;0;7;0;7;7;7;7;0;0;0;0;0;8;7;7;0;0;0;0;0;0;0;0;0;7;7;0;0;0;0;0;0;0;7;7;0;7;8;8;7;0;0;0;8;8;8;8;0;0;0;0;7;0;0;0;0;7;7;7;7;0;0;7;0;8;8;7;0;0;0;0;0;0;0;0;0;0;7;7;7;7;7;8;8;0;0;7;7;7;7;0;7;7;7;7;0;0;0;0;0;0;7;7;7;8;7;7;0;0;7;7;7;0;0;0;7;0;7;9;9;7;0;7;8;8;7;0;8;0;8;9;8
803;Трубина И.И.;Педагогические условия достижения финалистами олимпиады по искусственному интеллекту высоких результатов;2022;Информатика и образование;37;1;0;0;0;8;0;0;0;0;0;0;0;0;7;0;0;8;10;0;0;0;7;8;7;7;0;0;0;0;0;0;0;0;0;7;7;0;0;0;0;0;0;0;9;0;0;0;0;0;7;0;0;0;0;0;0;8;0;0;7;8;7;0;8;8;0;0;7;0;7;7;7;0;8;0;0;0;8;0;0;0;0;7;0;0;0;0;0;0;0;0;0;0;0;7;0;0;0;0;0;0;7;7;0;0;0;0;8;0;0;0;0;0;8;8;7;7;0;0;0;0;0;8;9;0;0;0;0;0;0;0;0;8;0;8;8;0;0;0;0;9;8;7;7;7;0;8;8;8;8;7;7;0;0;8;7;0;8;8;7;0;0;7;7;7;0;7;7;7;7;0;8;8;7;0;0;0;0;0;0;8;8;8;7;0;0;0;0;0;7;8;8;8;8;8;7;8;0;7;0;0;0;0;0;8;0;0;7;0;7;0;7;0;8;0;0;8;0;8;8;0
802;"Столбова И.Д.; Кочурова Л.В.; Носов К.Г.";О возрастании роли цифровой 3D-модели в проектной деятельности и геометрографическом образовании;2022;Информатика и образование;37;1;0;0;0;0;0;0;0;0;0;0;0;0;0;0;0;0;0;0;0;2;0;0;0;0;0;0;0;10;0;0;0;0;0;5;0;0;0;0;0;0;0;0;0;0;5;5;0;0;0;0;8;0;0;0;0;0;0;7;8;0;0;0;0;0;8;8;7;7;0;7;7;7;0;0;0;0;0;0;0;0;0;0;0;0;0;0;0;0;0;0;0;0;9;0;0;0;0;0;0;0;0;0;0;0;0;0;0;0;0;0;10;0;9;8;0;0;0;0;0;0;0;0;0;0;0;0;0;0;0;0;0;0;0;8;8;0;0;0;0;0;0;0;0;0;9;0;8;7;0;0;8;0;0;7;0;0;0;0;0;0;0;0;10;0;8;0;7;0;0;0;9;0;0;0;0;0;0;0;0;0;7;0;0;0;0;0;0;0;0;0;0;8;0;0;0;7;0;0;0;0;0;0;0;0;0;0;7;8;0;0;0;8;0;0;0;8;0;8;0;0
801;"Андрюшкова О.В.; Карева М.А.; Фишгойт Л.А.; Марушина Е.В.";Интерактивные модули LMS Moodle в управлении мотивацией студентов;2022;Информатика и образование;37;1;0;0;0;0;0;8;0;0;0;0;0;0;0;0;0;0;0;0;0;0;0;0;10;0;0;0;0;0;0;0;0;0;0;0;0;0;9;0;0;0;0;0;0;0;8;8;0;0;0;0;9;0;0;0;0;0;0;8;0;0;7;0;0;0;7;0;0;0;7;0;8;0;0;0;0;0;0;0;0;0;0;10;0;0;0;0;0;0;0;7;0;7;7;7;7;0;0;0;0;0;8;0;0;0;0;0;0;0;0;0;0;0;0;8;0;0;9;0;0;0;7;0;0;0;0;8;0;0;9;0;0;8;0;9;0;0;0;0;0;8;0;0;9;0;0;9;0;0;0;0;0;0;0;8;0;0;0;0;0;0;0;0;0;0;0;7;7;7;0;0;0;7;0;0;7;7;7;7;0;9;0;8;9;0;0;0;0;0;0;8;8;0;0;0;0;0;0;0;8;8;0;0;0;8;0;7;7;0;0;0;8;0;8;0;0;8;0;8;8;0
800;"Маркушевич М.В.; Федосов А.Ю.";Основные методические подходы к использованию свободного программного обеспечения в курсе информатики на уровне основного общего образования;2022;Информатика и образование;37;1;0;0;10;0;0;0;0;0;0;0;0;0;0;0;0;8;0;0;0;0;8;0;0;0;0;0;0;0;0;0;0;0;0;0;0;0;0;0;0;0;0;9;0;0;0;0;0;0;8;0;0;9;0;0;0;0;0;7;0;8;0;0;0;0;7;8;0;0;0;8;10;0;0;0;0;0;0;0;0;0;0;0;0;0;0;0;0;0;0;0;0;5;0;0;5;0;0;0;0;0;0;0;0;0;0;0;7;7;0;0;0;0;9;8;6;9;0;0;0;0;7;0;7;0;0;0;0;0;0;0;0;0;0;8;8;0;0;0;0;6;9;0;0;0;0;7;8;8;8;0;8;0;7;9;7;0;0;8;0;0;0;0;0;7;0;8;9;7;8;7;0;9;7;0;7;7;7;0;8;8;0;7;7;7;0;8;7;0;7;7;8;0;0;7;0;0;0;7;0;0;0;0;0;0;0;0;8;8;7;0;7;0;0;0;0;8;0;8;9;8
799;Бурняшов Б.А.;Импортозамещение программного обеспечения учебного процесса российских вузов;2022;Информатика и образование;37;1;0;0;0;0;0;5;5;5;0;0;0;0;0;0;0;0;0;0;0;0;9;0;0;0;0;7;0;0;0;0;0;0;0;0;0;0;8;0;0;0;0;0;0;0;7;7;0;0;0;0;9;8;0;0;0;0;0;0;5;0;0;0;0;0;5;0;0;8;0;0;7;7;0;0;0;0;0;0;0;0;0;8;7;5;0;0;0;0;0;0;0;8;0;0;0;9;0;0;0;0;0;0;0;0;0;0;0;7;0;0;0;0;6;6;6;6;0;0;0;5;5;5;5;5;0;6;0;7;0;0;0;0;8;8;9;0;0;0;0;7;8;0;0;7;7;0;0;0;0;0;0;0;0;8;7;0;0;0;0;0;0;0;0;8;0;6;6;6;6;6;7;7;0;0;8;8;7;0;8;0;7;7;0;0;8;8;8;0;0;7;7;7;8;0;7;0;0;7;6;6;0;0;0;6;0;6;8;8;7;7;7;0;7;0;0;8;0;8;9;8
798;"Леонова Е.А.; Боровская Е.В.; Дмитриева О.А.";Педагогический хакатон как способ совместного проектного обучения будущих педагогов и студентов ИТ-направлений;2022;Информатика и образование;37;1;0;0;0;0;0;9;0;0;0;0;0;0;0;0;5;6;0;0;0;0;7;6;6;0;0;0;0;0;9;0;0;0;0;0;8;0;7;0;0;0;0;0;0;0;10;0;0;0;0;0;9;9;0;0;0;0;0;8;8;0;0;8;0;0;10;8;0;7;0;0;8;8;9;0;0;0;7;7;0;0;0;6;0;0;0;0;0;0;0;8;0;6;7;0;0;0;0;9;0;0;0;7;0;0;0;0;6;0;0;6;0;0;10;0;0;8;0;0;0;0;7;0;7;7;0;7;0;0;7;8;0;0;0;9;7;0;0;0;0;8;0;0;0;0;8;8;8;8;0;0;8;0;8;8;0;0;7;7;0;7;7;7;7;7;0;8;9;0;8;8;9;8;0;0;8;8;7;7;0;8;8;8;8;0;0;0;0;0;0;0;0;9;9;7;7;8;0;8;7;7;0;0;0;8;0;7;7;7;7;0;7;8;7;0;0;8;0;8;8;7
797;"Панишева О.В.; Логинов А.В.";Формирование навыков цифрового этикета у студентов педагогических вузов;2022;Информатика и образование;37;1;0;0;0;0;5;5;5;5;0;0;0;0;0;0;0;0;0;0;0;0;0;0;0;0;0;0;0;0;9;0;0;0;0;0;0;0;9;0;0;0;0;0;0;5;0;0;0;0;9;0;9;0;0;0;0;0;0;8;7;0;7;0;0;0;0;7;0;0;0;0;9;8;0;0;0;0;0;0;0;0;0;7;0;0;0;0;0;0;0;0;0;8;0;0;0;0;0;0;0;0;0;0;0;0;0;0;0;0;0;0;0;0;0;0;0;7;0;0;0;7;0;0;0;0;0;7;0;0;0;0;0;0;0;8;8;0;0;0;0;7;0;0;0;0;0;0;0;0;0;0;0;0;9;0;8;0;0;0;0;0;0;0;0;0;0;9;8;0;0;0;8;0;0;0;0;8;8;0;0;0;0;0;0;0;10;8;0;0;0;0;0;0;8;0;9;0;0;9;0;0;0;0;0;0;0;0;8;0;0;0;0;0;0;0;0;0;0;0;10;0
796;Редакционная с.;Итоги XVIII Всероссийского конкурса научно-практических работ ИНФО-2021;2022;Информатика и образование;37;1;8;8;8;8;0;0;0;0;0;0;0;0;5;0;0;0;0;0;0;0;0;5;0;0;0;0;0;0;5;0;0;0;0;0;0;0;0;0;0;8;8;8;8;0;0;0;5;0;8;0;8;9;0;5;0;0;0;0;0;0;0;0;0;0;0;0;0;0;0;0;0;0;0;0;0;0;0;0;0;0;0;0;0;0;0;0;0;0;0;0;0;0;0;0;0;0;0;0;0;0;0;0;0;0;0;0;0;0;0;0;0;0;0;0;0;0;0;0;0;0;0;0;0;0;0;0;0;0;0;0;0;0;0;8;8;0;0;0;0;0;0;0;0;0;0;0;0;0;0;0;0;0;0;0;0;0;0;0;0;0;0;0;0;0;0;0;0;0;0;0;0;0;0;0;0;0;0;0;0;0;0;0;0;0;0;0;0;0;0;0;0;0;0;0;0;0;0;0;0;0;0;0;0;0;0;0;0;0;0;0;0;0;0;0;0;0;0;7;0;0
765;"Смирнов М.В.; Поленок В.М.";Опыт разработки веб-приложения для моделирования реляционных баз данных с функцией прямого инжиниринга для обучения студентов технических специальностей;2021;Информатика и образование;0;9;0;0;0;0;0;8;0;0;2;0;0;0;0;0;0;0;0;10;0;0;8;0;0;0;0;0;0;9;0;0;0;0;0;0;0;0;7;0;0;0;0;0;0;0;9;7;0;0;0;0;8;0;0;0;0;0;0;0;0;0;0;0;0;0;0;0;0;0;0;7;7;0;9;0;0;0;0;0;0;0;0;5;0;0;0;0;5;0;0;7;0;0;0;0;0;0;0;0;0;0;0;0;0;0;0;0;8;9;0;8;0;0;0;0;0;0;0;0;0;0;0;0;0;0;0;0;0;0;0;0;0;0;0;9;7;0;0;0;0;0;0;0;0;0;8;0;0;0;0;0;7;0;0;8;0;0;0;0;10;7;0;0;7;0;0;0;0;0;0;0;8;0;0;0;0;0;0;0;0;0;7;0;0;0;0;0;0;0;0;0;0;7;0;0;0;0;0;0;0;0;0;0;0;0;0;0;0;0;0;0;0;8;0;0;0;8;0;8;7;0
764;"Стоянов С.Н.; Глушкова Т.А.; Стоянова-Дойчева А.Г.; Крастева И.К.";Виртуальное образовательное пространство: концепция, архитектура, применение;2021;Информатика и образование;0;9;0;0;0;0;0;0;0;0;0;0;0;0;0;0;0;0;0;0;7;0;0;0;0;0;0;0;0;0;0;5;0;0;0;0;6;0;9;8;0;0;0;0;6;0;7;7;0;0;0;0;8;0;0;0;8;0;0;0;7;0;7;0;8;7;0;6;8;9;0;7;7;0;0;10;0;0;8;8;0;0;0;9;0;0;0;0;6;0;0;0;0;7;0;9;0;0;0;0;0;0;8;6;0;0;0;0;7;0;0;0;0;0;0;0;8;0;0;0;0;0;0;7;0;0;8;9;0;7;0;0;0;0;0;8;7;0;0;0;0;6;0;0;0;0;7;0;0;0;0;0;6;0;0;8;0;0;7;0;0;0;0;8;0;0;0;0;7;0;7;0;7;0;0;0;0;8;0;0;0;7;7;0;0;0;0;0;0;0;0;0;0;0;8;0;0;0;0;0;0;0;0;0;0;0;0;0;8;9;0;0;0;0;0;0;0;7;0;7;8;0
762;"Половина И.П.; Шестаков А.П.; Захарова В.А.; Егоров К.Б.";Независимая оценка сформированности отдельных цифровых навыков обучающихся общеобразовательных организаций: подходы и результаты;2021;Информатика и образование;0;9;0;0;0;8;0;0;0;0;0;0;0;0;0;0;7;0;0;0;0;0;6;0;0;0;0;0;0;0;7;0;0;0;0;0;7;0;0;0;0;0;0;10;0;0;0;0;0;0;7;0;0;9;7;6;0;0;0;0;8;0;0;6;0;0;0;0;0;0;0;0;7;7;0;0;0;0;0;0;0;0;0;6;0;0;0;0;0;0;0;0;0;0;0;0;0;0;0;0;0;0;0;8;7;0;0;0;0;0;0;0;0;0;7;7;0;0;0;0;0;0;0;0;0;0;5;8;0;0;0;0;0;8;0;8;0;8;0;0;0;6;0;0;0;0;0;8;0;0;0;8;0;0;9;9;7;0;7;0;0;0;0;8;7;0;0;0;0;0;7;7;0;8;0;0;7;7;6;7;9;0;0;8;0;0;8;9;0;0;0;6;6;0;8;0;8;0;0;8;8;8;0;0;0;9;0;0;7;0;0;0;7;0;8;0;0;8;0;8;9;0
761;"Руцкая К.А.; Буторин А.Н.";Мотивация обучающихся к физической активности в процессе обучения программированию;2021;Информатика и образование;0;9;0;0;0;0;0;0;0;0;0;0;0;0;10;0;0;9;0;0;0;0;5;0;0;0;0;0;0;0;0;0;0;0;0;5;8;0;7;0;0;0;0;0;10;0;0;0;0;0;5;0;0;5;0;0;0;0;0;7;0;0;0;0;7;0;0;6;0;0;0;0;0;9;8;0;0;0;0;0;0;0;0;0;0;0;0;0;0;0;0;0;0;5;0;6;0;0;0;0;0;0;0;0;0;0;0;0;8;0;0;0;0;0;6;0;6;0;0;0;0;6;0;6;0;0;0;7;0;0;0;0;9;0;0;8;0;9;0;0;0;0;0;0;0;0;0;0;0;0;8;0;6;0;7;0;0;0;0;8;0;0;0;0;0;0;0;0;0;6;0;0;0;0;0;0;0;0;0;0;0;9;0;8;0;0;0;0;0;0;0;0;7;0;7;0;0;0;0;0;0;10;0;0;0;0;0;0;0;0;0;0;0;9;8;0;0;9;0;0;8;0
760;"Косова Е.А.; Гапон А.С.; Редкокош К.И.";Исследование доступности электронных образовательных ресурсов на университетской платформе Moodle;2021;Информатика и образование;0;9;0;0;0;0;0;0;0;0;0;0;0;0;0;0;5;8;0;0;0;0;0;8;0;0;0;0;0;0;0;0;0;0;0;0;0;0;9;0;0;0;0;0;0;0;5;5;0;0;0;0;8;8;0;7;10;0;0;0;5;0;0;0;0;0;0;5;0;0;0;0;7;7;0;0;0;0;0;0;0;0;0;10;0;0;7;0;0;0;0;0;0;9;0;0;0;0;0;0;0;0;8;0;0;0;0;0;7;0;0;7;0;0;0;0;0;0;0;0;0;5;5;5;0;0;0;8;0;0;0;0;0;9;0;8;8;0;0;0;0;8;8;8;0;0;0;0;0;0;0;0;0;0;9;9;0;0;0;7;0;0;0;0;0;7;0;6;6;0;0;0;7;0;0;0;8;8;6;7;7;6;0;6;0;0;7;7;0;0;0;0;0;0;7;0;7;0;0;0;7;7;0;0;0;7;0;6;7;0;7;0;7;8;8;0;0;8;0;8;9;8
759;"Абдуразаков М.М.; Батыгов З.О.";Современные проблемы обеспечения информационной безопасности в образовательно-педагогической сфере;2021;Информатика и образование;0;10;0;0;0;0;0;0;0;0;0;0;0;0;0;0;8;0;0;0;0;10;0;0;0;0;0;0;0;0;0;0;0;0;0;0;0;0;0;0;0;0;0;0;0;0;0;0;0;0;7;0;0;0;0;0;0;0;0;8;7;7;7;0;0;0;0;0;8;0;7;7;7;0;0;0;0;0;0;0;0;0;0;0;0;0;0;0;0;0;0;0;0;5;0;0;0;0;0;0;0;0;0;0;6;0;0;0;0;0;0;0;0;0;0;6;0;0;0;0;0;0;0;0;0;0;5;0;0;0;0;0;0;0;0;0;9;0;0;0;0;6;9;0;0;0;0;9;0;0;0;0;0;8;8;9;9;0;7;0;0;0;0;7;0;0;0;6;6;0;0;0;8;8;7;0;0;7;0;0;10;0;0;7;0;0;9;9;8;0;0;8;7;0;8;0;8;0;0;9;0;0;0;0;0;0;0;0;8;0;7;0;7;0;0;0;0;0;0;8;7;0
758;"Григорьев С.Г.; Родионов М.А.; Кочеткова О.А.";Образовательные возможности технологий дополненной и виртуальной реальности;2021;Информатика и образование;0;10;0;0;0;8;0;0;0;0;0;0;0;0;0;0;7;8;0;0;0;0;7;0;0;0;0;0;0;0;0;0;0;0;0;5;6;0;7;0;0;0;0;9;9;0;0;0;0;0;8;0;0;9;0;0;6;0;0;7;6;6;0;7;0;0;7;7;0;0;0;7;8;7;8;8;0;0;0;0;0;0;0;0;0;0;0;0;0;0;0;8;0;8;0;6;0;0;10;10;0;0;0;0;0;0;0;0;7;0;0;0;0;0;8;8;7;0;0;0;0;6;0;0;0;0;0;6;0;0;0;0;0;0;0;8;7;0;0;0;0;0;8;0;0;0;6;6;6;6;0;0;7;0;8;9;7;0;0;7;0;0;0;0;0;7;0;6;7;0;6;6;7;7;0;0;8;7;6;0;0;7;0;7;7;0;0;0;0;0;0;0;7;0;8;0;7;0;0;7;6;0;0;0;0;7;0;6;7;7;6;0;6;0;7;0;0;8;0;8;9;7
757;Аникьева М.А.;Применение графов знаний в образовательной среде для персонализированного обучения;2021;Информатика и образование;0;10;0;0;0;0;0;5;5;5;0;0;0;0;7;0;7;0;8;7;0;0;7;8;0;0;0;0;0;0;7;0;0;0;0;0;0;0;9;0;0;0;0;0;7;7;7;7;7;7;7;7;7;7;7;7;0;0;0;8;8;8;7;0;10;0;8;8;8;8;0;8;8;9;9;9;0;0;8;7;0;0;0;8;0;0;8;0;0;0;0;0;0;7;0;0;0;0;0;0;0;0;8;7;7;7;0;0;7;7;0;0;0;0;8;7;7;7;0;0;0;7;7;7;7;7;7;8;7;7;7;0;0;8;0;9;9;8;0;0;0;8;9;8;0;0;8;7;0;8;8;7;8;0;7;8;7;0;7;7;7;7;7;7;7;7;0;7;7;7;7;7;8;8;7;0;7;7;7;7;7;8;8;7;7;0;0;0;0;0;7;7;7;8;8;7;7;7;0;7;7;7;7;7;7;7;7;7;9;9;8;8;8;8;8;7;0;8;7;8;9;8
756;"Аджемов А.С.; Денисова А.Б.; Сатыбалдина Д.Ж.; Сеилов Ш.Ж.";Эффективность и проблемы дистанционного обучения: опыт России и Казахстана;2021;Информатика и образование;0;10;0;0;0;0;0;5;5;5;0;0;2;0;0;0;7;0;0;0;7;7;7;5;0;0;0;7;0;0;7;7;0;0;0;0;0;0;10;7;0;0;0;0;0;0;9;9;0;0;0;0;9;7;0;0;0;0;0;8;7;0;7;0;7;0;7;7;7;7;7;7;8;8;0;8;7;0;7;7;7;0;7;8;7;0;7;0;7;0;7;8;7;9;7;7;7;7;0;0;0;0;8;7;7;7;7;0;7;7;0;7;0;7;8;8;8;8;8;0;0;8;8;7;7;7;0;9;7;8;7;0;0;9;9;9;8;8;0;0;0;9;8;0;0;8;8;8;7;7;7;7;7;0;8;9;8;7;7;7;7;7;0;7;0;7;0;8;8;8;8;8;8;8;8;0;8;8;7;7;7;9;8;8;8;8;7;7;7;0;8;8;8;8;8;8;8;8;0;8;9;9;8;8;0;9;8;9;8;8;8;7;8;9;9;8;8;9;8;9;9;8
755;"Гранчарова-Христова М.Т.; Моралийска Н.С.; Русев К.Н.; Иванова В.А.; Табакова-Комсалова В.В.";Application of ontologies and digital libraries in school education;2021;Информатика и образование;0;10;0;0;0;1;0;0;0;0;0;0;0;0;7;0;7;0;9;8;0;0;1;0;0;0;7;7;0;0;1;0;0;0;0;0;7;0;8;0;0;0;0;8;8;0;0;0;0;0;8;0;0;0;0;0;0;7;0;7;0;0;7;0;8;7;8;7;0;8;8;0;0;7;0;9;0;0;9;8;0;0;0;8;0;0;0;0;7;0;0;0;0;7;0;8;0;0;0;0;0;0;7;0;0;0;7;0;7;8;0;0;0;0;8;0;8;0;0;0;0;0;0;7;0;0;8;9;0;0;7;0;0;8;0;8;8;0;0;0;0;7;7;0;0;7;0;7;7;7;0;0;0;0;0;7;0;0;7;0;0;0;0;7;0;7;0;7;7;0;7;7;0;7;0;0;0;0;0;0;0;8;0;7;7;0;0;0;0;0;0;7;7;0;7;0;7;0;0;0;0;0;0;0;0;0;0;0;8;8;0;0;0;8;7;0;0;7;0;7;7;0
754;"Чехович Ю.В.; Беленькая О.С.";Методика внедрения и использования электронных средств обнаружения заимствований в системе среднего образования;2021;Информатика и образование;0;10;0;0;8;10;0;5;5;5;5;5;0;0;0;0;0;0;0;0;0;0;0;0;0;0;0;0;0;0;0;0;0;0;0;0;5;0;0;0;0;0;0;8;10;0;5;5;5;0;9;0;5;0;7;7;0;0;0;8;0;8;0;0;0;0;8;5;0;0;0;8;9;0;0;0;0;0;0;0;0;0;0;9;0;0;0;0;0;0;0;0;0;5;0;0;0;0;0;0;0;0;0;0;5;0;0;0;0;0;0;0;0;0;9;8;5;0;0;0;0;0;0;8;8;5;0;9;0;0;5;0;0;0;0;9;8;0;0;0;0;5;0;0;0;0;5;7;7;7;0;0;8;0;0;8;8;0;0;0;0;0;0;0;0;0;0;7;7;7;7;7;7;8;7;0;7;7;7;7;7;7;7;0;0;7;8;8;8;0;0;7;7;7;0;7;0;0;0;7;7;0;0;0;0;7;0;7;8;0;7;0;8;0;7;0;0;8;0;8;9;8
750;"Обухов А.С.; Томилина М.В.";Развитие цифровых образовательных технологий в России до пандемии: история и особенности индустрии EdTech;2021;Информатика и образование;0;8;5;0;0;0;7;0;0;0;0;0;0;0;9;9;8;0;0;0;0;0;0;0;0;0;0;0;0;0;0;0;0;0;0;0;5;0;9;0;0;0;0;0;5;5;0;0;0;8;8;0;8;0;0;0;0;0;0;7;0;0;7;0;8;0;5;5;0;0;0;0;0;0;0;0;6;0;6;0;0;0;0;7;5;5;7;0;0;0;0;0;0;7;0;0;0;0;6;6;0;0;7;7;0;0;0;0;0;0;0;0;0;0;0;0;0;0;0;0;0;0;0;0;0;0;6;7;0;0;0;0;0;0;8;8;9;0;0;0;0;7;0;0;0;0;0;0;0;0;0;0;0;0;8;8;0;0;6;0;0;0;0;6;0;0;0;6;6;0;0;0;0;7;0;0;7;7;7;7;0;0;0;7;0;0;0;0;0;0;0;0;0;0;8;0;7;0;0;7;7;7;0;0;0;7;0;0;8;0;8;8;0;0;8;0;0;8;0;8;8;8
749;"Муканова А.Р.; Оцоков Ш.А.";Исследование применимости методов машинного обучения для оценки деятельности кафедр;2021;Информатика и образование;0;8;0;0;0;0;0;8;0;7;0;0;2;0;0;0;0;8;10;0;0;2;0;0;0;0;0;0;0;5;5;0;0;0;0;0;0;0;0;0;0;0;0;0;0;0;8;7;0;0;0;0;9;0;8;0;0;0;0;0;9;0;0;0;0;0;0;0;0;0;0;0;0;0;9;8;0;0;10;7;0;0;0;7;0;0;0;0;0;0;0;0;0;0;0;0;0;0;0;0;0;0;8;0;0;0;0;0;9;0;0;0;0;0;0;0;0;0;0;0;0;0;0;0;0;0;0;0;0;0;0;0;0;8;0;9;0;9;0;0;0;0;0;0;0;0;8;0;0;0;7;7;0;0;0;7;0;0;0;8;0;0;7;8;0;0;0;0;0;0;0;0;8;0;0;0;0;0;0;0;0;0;7;0;0;0;0;0;0;0;0;0;0;7;0;0;0;0;0;0;8;9;0;8;0;8;0;0;0;9;0;0;8;9;8;0;0;8;0;8;7;0
748;"Попов Н.И.; Кожурина А.В.";Исследование специальных способностей будущих учителей информатики в процессе подготовки для работы с одаренными детьми;2021;Информатика и образование;0;8;0;0;0;0;0;8;0;0;0;0;5;0;0;0;8;8;0;0;0;0;7;6;5;0;0;0;0;0;10;8;0;0;0;0;0;0;9;0;0;0;0;7;7;0;8;0;0;5;0;0;8;10;0;5;0;10;0;0;7;0;7;0;0;0;7;0;0;0;0;7;9;9;0;0;0;0;0;0;0;0;0;9;0;0;0;0;0;0;0;0;0;7;0;0;0;0;0;0;0;0;0;0;0;0;0;0;0;0;0;7;0;0;8;7;0;7;0;0;0;0;6;0;0;6;0;7;0;0;0;8;0;8;0;9;7;8;0;0;0;8;8;6;0;0;8;0;7;0;0;0;7;0;0;8;0;0;0;7;0;7;0;0;0;0;0;6;7;0;6;0;8;7;0;0;0;7;6;0;0;7;7;0;0;0;0;0;0;0;6;6;6;8;0;0;0;0;0;0;8;9;0;0;0;8;0;0;7;7;0;0;0;8;8;0;0;8;0;8;9;0
747;"Кушнир М.Э.; Рабинович П.Д.; Заведенский К.Е.; Базарова Г.Т.; Царьков И.С.";Модель образовательного профиля личности для управления образовательной деятельностью и развития личностного потенциала;2021;Информатика и образование;0;8;0;0;0;5;5;5;5;5;0;0;0;0;0;0;0;0;0;0;0;0;0;0;0;0;0;0;0;0;0;0;0;0;0;0;7;0;7;0;0;0;0;8;8;8;8;8;0;0;7;7;7;0;0;0;0;7;0;8;9;0;0;0;9;0;7;7;9;9;9;9;8;0;0;0;0;0;0;0;0;0;0;7;0;0;0;0;0;0;0;0;0;0;0;0;0;0;0;0;0;0;0;0;8;0;0;0;0;0;0;0;0;0;7;7;7;7;0;0;0;0;7;7;7;0;0;7;8;8;7;0;0;8;0;9;9;0;0;0;0;8;0;0;0;0;0;8;8;8;0;0;8;8;7;7;7;0;0;0;0;0;0;0;0;0;0;8;8;8;8;7;9;9;8;0;0;7;7;0;0;8;8;0;8;0;0;0;0;0;8;9;8;8;0;9;9;8;0;8;7;0;0;0;0;8;0;7;10;10;8;0;8;0;0;0;0;8;0;8;8;7
746;Сергеев Я.Д.;Новый взгляд на бесконечно большие и бесконечно малые величины: методологические основы и практическое использование этих чисел в вычислениях на компьютере;2021;Информатика и образование;0;8;0;0;0;0;0;0;0;8;0;0;5;0;0;0;8;7;7;6;0;0;0;10;0;0;0;0;0;0;0;6;0;0;0;0;7;0;0;0;0;0;0;0;0;0;0;8;0;7;0;0;8;0;0;0;0;0;0;8;6;6;6;6;6;0;6;6;8;7;0;7;8;0;9;9;0;0;7;0;0;0;0;9;0;0;0;0;0;0;0;0;0;0;0;6;0;0;0;0;0;0;7;6;0;0;0;0;7;6;0;0;0;0;6;6;6;6;0;0;0;6;6;6;6;6;0;8;6;6;6;8;0;8;8;9;9;8;0;0;7;7;8;10;0;0;7;8;7;7;7;7;7;7;7;8;7;0;8;8;7;0;0;9;7;0;0;7;7;7;7;7;7;8;7;0;7;7;7;7;7;7;7;8;7;7;7;7;7;0;7;7;7;7;8;7;7;7;0;7;8;8;7;7;7;8;0;7;9;8;8;7;7;9;8;7;7;9;8;8;9;8
744;"Пиявский С.А.; Кирюков С.Р.; Кузнецов А.С.; Кулаков Г.А.";Информационная технология профориентации творчески одаренных студентов вузов. развивающая деятельность;2021;Информатика и образование;0;7;0;0;0;0;0;5;5;5;0;0;0;0;0;0;5;5;5;5;5;5;5;0;0;0;0;0;0;8;0;7;0;0;0;5;5;0;0;0;0;0;0;0;0;0;8;8;5;0;0;0;8;0;7;7;0;10;0;0;8;0;7;7;8;0;8;7;0;9;8;8;8;8;9;9;0;0;9;8;0;0;0;7;7;7;0;0;7;0;0;7;7;7;7;7;7;0;0;0;0;0;8;7;7;7;7;0;7;7;0;7;0;0;9;9;7;8;7;0;0;7;8;8;8;7;7;8;7;7;7;0;0;8;7;9;8;9;0;0;9;8;7;0;0;0;8;8;9;8;8;8;8;8;7;8;7;0;7;7;7;7;7;7;7;7;7;8;8;8;8;7;9;8;7;7;7;7;7;7;7;9;9;8;8;8;7;7;7;0;8;8;8;9;8;8;8;8;0;8;8;9;8;8;7;8;7;7;9;10;8;0;9;9;9;8;0;9;8;9;9;8
743;Иманова О.А.;Освоение технологии электронного портфолио будущими педагогами-тьюторами в условиях дистанционного обучения;2021;Информатика и образование;0;7;0;0;0;0;0;10;0;0;0;0;0;0;0;0;0;0;0;0;0;0;7;0;0;0;0;0;0;0;10;0;0;0;0;0;0;0;10;0;0;0;0;0;0;0;10;0;0;0;0;0;9;8;0;0;0;0;0;7;8;0;0;0;7;0;7;7;0;0;0;8;0;9;0;0;0;0;0;0;0;0;0;9;0;0;0;0;0;0;0;0;10;7;0;0;0;7;0;0;0;0;0;0;0;0;0;0;0;0;0;0;0;0;8;0;0;7;7;0;0;0;7;0;0;7;0;0;0;0;8;0;0;0;0;8;0;0;0;0;0;8;0;0;0;0;8;0;7;0;0;0;0;0;0;8;0;0;0;0;0;0;0;0;0;0;0;7;7;0;0;0;8;0;0;0;8;8;7;0;0;7;7;0;0;0;0;0;0;0;0;7;7;8;0;0;0;0;0;0;0;0;0;0;0;0;0;0;0;0;0;0;0;0;0;0;0;7;0;7;8;0
742;Зубрилин А.А.;Организационно-методические проблемы подготовки будущих педагогов в условиях дистанционного формата обучения;2021;Информатика и образование;0;7;0;0;0;0;0;0;0;0;0;0;7;7;0;0;0;0;0;0;0;0;7;0;0;0;0;0;0;0;10;0;0;0;0;0;5;0;10;8;6;0;0;0;0;0;9;0;0;7;0;0;9;8;6;6;0;0;0;7;7;0;0;0;0;0;0;6;0;0;0;0;8;8;0;0;0;0;0;0;0;0;0;10;0;0;6;0;0;0;0;0;0;7;0;0;0;0;0;0;0;0;0;0;0;0;0;0;0;0;0;5;0;0;7;6;0;0;6;0;0;6;6;0;0;7;0;8;0;0;6;0;0;0;0;8;7;0;0;0;0;7;0;0;0;0;8;0;0;0;0;0;7;0;0;8;0;0;0;0;0;0;0;0;0;7;0;7;7;6;0;7;8;0;0;0;8;8;7;0;0;7;7;7;7;0;0;0;0;0;6;6;7;8;8;0;0;0;0;0;7;7;0;0;0;7;0;6;0;7;0;0;7;0;7;0;0;8;0;8;8;0
741;"Бужинская Н.В.; Васева Е.С.";Учет подходов к формированию команды при подготовке студентов к участию в соревновательных мероприятиях;2021;Информатика и образование;0;7;0;0;0;0;0;0;0;0;0;0;0;0;0;0;0;9;0;0;0;0;0;0;0;0;0;0;0;0;7;0;0;0;0;0;6;0;7;7;0;0;0;0;0;0;8;8;0;0;0;0;9;0;0;0;0;0;0;0;8;0;0;0;0;0;7;7;0;0;0;7;8;0;0;0;0;0;0;0;0;0;0;7;0;0;0;0;0;0;0;0;0;6;0;0;0;0;0;0;0;0;0;0;6;0;0;0;8;0;0;0;0;0;9;0;7;9;0;0;0;7;0;0;0;6;0;0;0;0;0;0;0;8;0;8;0;0;0;0;0;9;8;0;0;0;8;7;7;0;8;8;7;0;0;8;0;0;0;9;0;0;0;0;0;0;0;8;10;8;8;7;8;8;0;0;0;0;0;0;0;0;8;0;0;0;0;0;0;0;0;7;8;8;0;0;0;0;0;0;0;0;0;0;0;7;0;7;0;7;0;0;0;0;8;0;0;8;0;7;8;0
740;"Уваров А.Ю.; Вихрев В.В.; Водопьян Г.М.; Дворецкая И.В.; Кочак Э.; Левин И.";Школы в развивающейся цифровой среде: цифровое обновление и его зрелость;2021;Информатика и образование;0;7;0;8;0;0;0;0;0;0;0;0;0;0;0;0;8;0;0;0;0;0;0;0;0;0;0;0;0;0;0;0;0;0;0;0;7;0;7;7;0;0;7;7;7;0;0;0;0;0;9;0;0;0;8;7;0;0;0;8;7;0;7;0;9;0;7;7;9;8;8;8;8;8;0;0;0;0;0;0;0;0;0;7;7;0;0;0;0;0;0;7;0;7;7;7;7;0;0;0;0;0;8;7;7;0;0;0;0;0;0;0;0;0;7;7;0;7;0;0;0;0;0;7;7;0;0;7;0;7;0;0;0;0;8;9;9;7;0;0;0;7;7;0;0;0;7;7;7;7;0;0;7;0;8;8;7;0;0;0;0;0;0;7;0;7;0;7;7;7;7;7;8;8;0;0;7;7;7;7;7;7;7;7;7;7;0;7;0;0;0;7;7;7;8;7;7;0;0;7;7;7;7;7;0;7;0;7;9;9;8;0;8;7;7;7;0;8;0;8;8;8
715;"Долинский М.С.; Долинская М.А.";Технология дифференцированного обучения основам алгоритмизации и программирования на первом курсе вуза на базе системы дистанционного обучения DL.GSU.BY;2021;Информатика и образование;0;6;0;0;0;0;0;8;0;0;0;0;0;0;0;0;5;10;0;0;0;0;5;5;0;0;0;0;0;0;5;0;0;0;0;0;0;0;9;9;0;0;0;0;0;0;10;0;0;0;0;0;8;8;0;0;0;0;0;7;0;0;0;0;9;0;0;7;0;0;0;0;9;8;8;0;0;0;0;0;0;0;0;9;0;0;0;0;0;0;0;0;0;7;0;0;8;0;0;0;0;0;7;0;0;0;0;0;0;0;0;0;0;0;8;0;7;8;0;0;0;0;0;7;0;0;8;9;0;0;7;0;0;7;0;9;0;0;0;0;0;7;0;0;0;0;8;0;0;0;10;0;8;0;0;9;0;0;0;10;0;0;0;0;0;7;0;7;8;7;8;0;8;8;0;0;0;0;0;0;0;8;7;0;8;0;0;0;0;0;0;0;8;8;0;0;0;0;0;0;9;9;0;0;0;8;0;7;0;0;0;0;0;8;8;0;0;9;0;8;8;0
714;Ефимова Е.А.;Каким должно быть цифровое домашнее задание: обзор зарубежных исследований;2021;Информатика и образование;0;6;0;7;7;7;0;0;0;0;0;0;0;0;0;0;0;0;0;0;0;0;0;7;0;0;0;0;0;0;0;0;0;0;0;0;0;0;8;0;0;0;7;7;7;0;0;0;0;0;9;0;0;0;0;0;0;0;0;8;0;0;7;0;7;7;7;0;7;0;0;7;8;8;0;0;0;0;0;0;0;0;0;7;0;7;0;0;0;0;0;0;0;7;8;7;7;0;0;0;0;0;8;0;8;0;0;0;0;0;0;0;0;0;7;7;7;7;0;0;0;7;7;7;7;0;0;8;7;7;7;0;0;0;7;8;9;7;0;0;0;7;7;7;0;0;0;7;7;7;7;7;7;0;7;7;7;0;0;7;7;7;7;7;7;7;0;7;7;7;7;7;7;7;0;0;7;7;7;7;7;8;0;7;7;0;0;0;0;0;7;7;7;0;8;7;7;0;0;7;8;7;7;7;0;7;0;7;7;7;7;7;7;7;7;7;7;8;7;8;9;8
713;Михайлова А.М.;Развитие критического и креативного мышления на уроках с использованием ИКТ: теоретические основания и практические примеры;2021;Информатика и образование;0;6;0;0;0;8;0;0;0;0;0;0;0;0;0;0;0;0;0;0;0;0;0;0;0;0;0;0;0;0;0;0;0;0;0;0;6;0;5;0;0;0;0;8;8;0;0;0;0;0;9;0;0;7;0;0;0;0;0;7;8;8;7;8;0;0;7;0;8;0;0;7;8;7;0;0;0;0;0;0;0;0;0;6;0;0;0;0;0;0;0;7;0;6;7;7;0;6;0;0;0;0;0;0;0;0;0;0;0;0;0;0;0;0;8;8;7;8;7;0;0;6;0;0;0;0;0;7;8;0;7;0;0;8;0;9;9;0;0;0;0;8;0;0;0;7;0;10;10;7;0;0;7;0;0;8;0;0;0;0;0;0;0;0;0;7;0;7;8;0;7;7;0;9;0;0;7;7;0;0;0;7;0;0;0;0;0;0;0;0;0;0;7;0;0;7;0;0;0;7;0;0;0;0;0;7;0;0;8;7;7;0;8;0;8;0;0;7;0;7;8;0
